uuid,name,gwp,declared_unit,category
d09a4e8e7e854b99807f69f0e72e11f7,"Acrylic Emulsion Primer (I), Jotun India Private Limited",0.7554342646 kgCO2e,1.0 kg,Paint_By_Mass
8f6710caa10d47cfb7f55deea18f31b2,"Fenomastic Hygiene Emulsion Silk, Jotun India Private Limited",2.455920634 kgCO2e,1.0 kg,Paint_By_Mass
2183bb8ceb164878af3663eb738ee727,"Jotashield ColourLast Matt (I), Jotun India Private Limited",2.738365961 kgCO2e,1.0 kg,Paint_By_Mass
841e00f93b154181b653902b5e4f1fa7,"Jotashield ColourLast Silk (I), Jotun India Private Limited",2.946449893 kgCO2e,1.0 kg,Paint_By_Mass
cd27c2c09fd2449db810e6ac864de090,"Jotashield Tex Ultra AA, Jotun India Private Limited",2.737977674 kgCO2e,1.0 kg,Paint_By_Mass
42d0d9bd0d874fafa14b6e470b4df6d4,"Jotashield WaterXtreme Basecoat, Jotun India Private Limited",2.38318435 kgCO2e,1.0 kg,Paint_By_Mass
4e01ca2b64e04cfebeb7252573ff1d1e,"Jotashield WaterXtreme Topcoat, Jotun India Private Limited",2.782866148 kgCO2e,1.0 kg,Paint_By_Mass
3b563f312ed347078b24c4bc5ea9ba4c,"SteelMaster 600WF, Jotun India Private Limited",3.600884317 kgCO2e,1.0 kg,Paint_By_Mass
8cb9d554657746da9a4ccb0a88d71071,"Steelmaster 1200WF, Jotun India Private Limited",3.471834481 kgCO2e,1.0 kg,Paint_By_Mass
